{
  "schemaVersion": "oasg.request.v1",
  "requestId": "x402_base_sepolia_walkthrough_001",
  "agentId": "onchain-on-call-base-sepolia-walkthrough",
  "chainId": "eip155:84532",
  "assetId": "eip155:84532/erc20:0x036cbd53842c5426634e7929541ec2318f3dcf7e",
  "amount": "1000",
  "counterparty": "0x1111111111111111111111111111111111111111",
  "purpose": "x402_resource_payment",
  "observedAt": "2026-07-10T23:57:29.262Z",
  "source": {
    "type": "x402.payment_required.v2",
    "reference": "http://127.0.0.1:4021/weather",
    "rawHash": "27208d351d4a3f65dcd31c783495f48920141471713aa30a49a8c1358fd347c6",
    "metadata": {
      "scheme": "exact",
      "acceptIndex": 0,
      "maxTimeoutSeconds": 300
    }
  }
}
