{
  "schemaVersion": "oasg.request.v1",
  "requestId": "req_block_001",
  "agentId": "ops-rebalancer-02",
  "chainId": "eip155:8453",
  "assetId": "eip155:8453/erc20:0x833589fcd6edb6e08f4c7c32d4f71b54bda02913",
  "amount": "750000000",
  "counterparty": "0x1111111111111111111111111111111111111111",
  "purpose": "x402_resource_payment",
  "observedAt": "2026-07-10T18:00:00Z",
  "spentInPeriod": "250000000"
}
